Grupos sensíveis;Efeitos na saúde;Precauções;Poluente
Pessoas com problemas respiratórios e cardíacos, idosos e crianças são os grupos sob maior risco.;"Agravamento grave de doença cardíaca ou pulmonar e mortalidade prematura em pessoas com doença cardiopulmonar e idosos; risco grave de efeitos respiratórios na população em geral.";"Everyone should avoid any outdoor exertion; people with respiratory or heart disease, the elderly and children should remain indoors.
";PM2.5
Pessoas com problemas respiratórios e cardíacos, idosos e crianças são os grupos sob maior risco.;"Aumento significativo dos sintomas respiratórios e agravamento de doenças pulmonares, como asma; aumento da probabilidade de efeitos respiratórios na população em geral";"People with respiratory disease, such as asthma, should avoid any outdoor activity; everyone else, especially the elderly and children, should limit outdoor exertion.
";PM10
Pessoas com asma e outras doenças respiratórias, idosos e crianças são os grupos sob maior risco.;"Efeitos respiratórios graves e respiração prejudicada são prováveis ??em crianças ativas, idosos e pessoas com doenças pulmonares, como asma; efeitos respiratórios cada vez mais graves são prováveis ??na população em geral.";"Crianças, idosos e pessoas com doenças pulmonares, como asma, devem permanecer em ambientes fechados; todos os outros, especialmente crianças, devem evitar esforços ao ar livre.";NO2
Pessoas com doenças cardíacas  compreendem o grupo sob maior risco.;"Agravamento grave dos sintomas cardiovasculares, como dor no peito, em pessoas com doença cardiovascular; comprometimento de atividades extenuantes na população em geral.";"Pessoas com doenças cardiovasculares, como angina, devem evitar esforços e fontes de CO, como trânsito intenso; todos os outros devem limitar esforços intensos.";CO
Pessoas com asma compreendem o grupo sob maior risco.;"Aumento dos sintomas respiratórios, como aperto no peito e chiado em pessoas com asma; possível agravamento de doença cardíaca ou pulmonar.";Crianças, asmáticos e pessoas com doenças cardíacas ou pulmonares devem limitar os esforços ao ar livre.;SO2
Crianças e pessoas com asma são os grupos sob maior risco.;"Sintomas cada vez mais graves e respiração prejudicada são prováveis ??em crianças e adultos ativos e pessoas com doenças respiratórias, como asma; probabilidade crescente de efeitos respiratórios na população em geral.";"Crianças e adultos ativos, e pessoas com doenças respiratórias, como asma, devem evitar qualquer esforço ao ar livre; todos os outros, especialmente crianças, devem limitar o esforço ao ar livre.";O3
